{
  "schema_version": 1,
  "id": "contract-counter",
  "backend": "contract-fixture",
  "tier": "U",
  "family": "contract",
  "deadline_ms": 5000,
  "steps": [
    {"action": {"type": "key", "n": 2, "state": 1}},
    {"action": {"type": "key", "n": 2, "state": 0}},
    {"assertion": {"path": "state.counter", "equals": 1}},
    {"assertion": {"path": "state.held", "equals": []}}
  ]
}
